{
  "schemaVersion": "1.0",
  "appType": "survey",
  "verifier": "survey_generic",
  "outputArtifact": "survey_result.json",
  "hypothesis": "Framing the onboarding survey around outcomes (what the user will achieve) rather than features raises reported satisfaction and continuation intent, without increasing perceived effort.",
  "compareBy": "system",
  "design": "ab_n",
  "armAssignment": "shared",
  "factors": [
    {
      "id": "context_variant",
      "label": "Onboarding framing",
      "space": "system",
      "source": "stimulus",
      "description": "How the product is framed before the persona answers. Only the framing text changes; question ids stay identical across levels so arms stay comparable.",
      "baseline": "feature",
      "levels": [
        { "id": "feature", "label": "Feature-framed", "value": "feature" },
        { "id": "outcome", "label": "Outcome-framed", "value": "outcome" }
      ]
    }
  ],
  "constants": [],
  "signals": [],
  "metricContract": {
    "primary": ["onboarding_satisfaction"],
    "secondary": ["likelihood_to_continue", "preferred_next_step"],
    "guardrail": ["perceived_effort"]
  }
}
